{
	"$schema": "https://json-schema.org/draft/2020-12/schema",
	"$id": "https://linked.art/api/1.0/schema/concept.json",
	"title": "Concept Schema",
	"description": "_crm:E55\\_Type_\nConcepts, Subjects and other categorizations.\nSee: [API](https://linked.art/api/1.0/endpoint/place/) | [Model](https://linked.art/model/)",
	"type": "object",
	"properties": {
		"@context": {"$ref": "core.json#/definitions/ContextStringOrArray"},
		"id": {"$ref": "core.json#/definitions/idProp"},				
		"type": {"allOf": [{"title": "General", "$ref": "core.json#/definitions/typeProp"}, 
			{"title": "Specific", "type": "string", "enum": ["Type", "Currency", "Material", "Language", "MeasurementUnit"]}]},
		"_label": {"$ref": "core.json#/definitions/labelProp"},
		"classified_as": {"$ref": "core.json#/definitions/classified_asProp"},
		"identified_by": {"$ref": "core.json#/definitions/identified_byProp"},
		"referred_to_by": {"$ref": "core.json#/definitions/referred_to_byProp"},
		"equivalent": {"allOf": [{"title": "General", "$ref": "core.json#/definitions/equivalentProp"}, 
			{"title": "Specific", "description": "List of concept entities", "type": "array", "items": {"$ref": "core.json#/definitions/AnyTypeRef"}}]},
		"representation": {"$ref": "core.json#/definitions/representationProp"},
		"member_of": {"$ref": "core.json#/definitions/member_ofSetProp"},
		"subject_of": {"$ref": "core.json#/definitions/subject_ofProp"},
		"attributed_by": {"$ref": "core.json#/definitions/attributed_byRelProp"},
		"created_by": {"title": "crm:P94i_was_created_by", "$ref": "core.json#/definitions/Creation"},

		"broader": {
			"title": "skos:broader",
			"description": "This concept is contained within one or more larger/broader concept entities",
			"type": "array", 
			"items": {"$ref": "core.json#/definitions/AnyTypeRef"}
		}
	},
	"required": ["@context", "id", "type", "_label"],
	"additionalProperties": false
}